
*** Running vivado
    with args -log test_imp.vdi -applog -m64 -product Vivado -messageDb vivado.pb -mode batch -source test_imp.tcl -notrace


****** Vivado v2017.2.1 (64-bit)
  **** SW Build 1957588 on Wed Aug  9 16:32:24 MDT 2017
  **** IP Build 1948039 on Wed Aug  9 18:19:28 MDT 2017
    ** Copyright 1986-2017 Xilinx, Inc. All Rights Reserved.

source test_imp.tcl -notrace
Design is defaulting to srcset: sources_1
Design is defaulting to constrset: constrs_1
INFO: [Netlist 29-17] Analyzing 4014 Unisim elements for replacement
INFO: [Netlist 29-28] Unisim Transformation completed in 0 CPU seconds
INFO: [Project 1-479] Netlist was created with Vivado 2017.2.1
INFO: [Device 21-403] Loading part xc7a35tcpg236-1
INFO: [Project 1-570] Preparing netlist for logic optimization
Parsing XDC File [C:/Users/Juan Carlos/Xilinx/project 34 segment/project_34_segment/project_34_segment.srcs/sources_1/new/Basys3_Master.xdc]
Finished Parsing XDC File [C:/Users/Juan Carlos/Xilinx/project 34 segment/project_34_segment/project_34_segment.srcs/sources_1/new/Basys3_Master.xdc]
INFO: [Opt 31-138] Pushed 0 inverter(s) to 0 load pin(s).
INFO: [Project 1-111] Unisim Transformation Summary:
No Unisim elements were transformed.

link_design: Time (s): cpu = 00:00:07 ; elapsed = 00:00:08 . Memory (MB): peak = 523.504 ; gain = 299.191
Command: opt_design
Attempting to get a license for feature 'Implementation' and/or device 'xc7a35t-cpg236'
INFO: [Common 17-349] Got license for feature 'Implementation' and/or device 'xc7a35t-cpg236'
Running DRC as a precondition to command opt_design

Starting DRC Task
Command: report_drc (run_mandatory_drcs) for: opt_checks
INFO: [DRC 23-27] Running DRC with 2 threads
report_drc (run_mandatory_drcs) completed successfully
INFO: [Project 1-461] DRC finished with 0 Errors
INFO: [Project 1-462] Please refer to the DRC report (report_drc) for more information.

Time (s): cpu = 00:00:01 ; elapsed = 00:00:00.734 . Memory (MB): peak = 526.133 ; gain = 2.629
INFO: [Timing 38-35] Done setting XDC timing constraints.

Starting Logic Optimization Task

Phase 1 Retarget
INFO: [Opt 31-138] Pushed 0 inverter(s) to 0 load pin(s).
INFO: [Opt 31-49] Retargeted 0 cell(s).
Phase 1 Retarget | Checksum: d9b80491

Time (s): cpu = 00:00:02 ; elapsed = 00:00:02 . Memory (MB): peak = 1031.555 ; gain = 0.000
INFO: [Opt 31-389] Phase Retarget created 0 cells and removed 532 cells

Phase 2 Constant propagation
INFO: [Opt 31-138] Pushed 0 inverter(s) to 0 load pin(s).
Phase 2 Constant propagation | Checksum: 135e77a53

Time (s): cpu = 00:00:02 ; elapsed = 00:00:02 . Memory (MB): peak = 1031.555 ; gain = 0.000
INFO: [Opt 31-389] Phase Constant propagation created 123 cells and removed 130 cells

Phase 3 Sweep
Phase 3 Sweep | Checksum: b7d31793

Time (s): cpu = 00:00:03 ; elapsed = 00:00:03 . Memory (MB): peak = 1031.555 ; gain = 0.000
INFO: [Opt 31-389] Phase Sweep created 11 cells and removed 0 cells

Phase 4 BUFG optimization
Phase 4 BUFG optimization | Checksum: b7d31793

Time (s): cpu = 00:00:03 ; elapsed = 00:00:03 . Memory (MB): peak = 1031.555 ; gain = 0.000
INFO: [Opt 31-389] Phase BUFG optimization created 0 cells and removed 0 cells

Phase 5 Shift Register Optimization
Phase 5 Shift Register Optimization | Checksum: b7d31793

Time (s): cpu = 00:00:03 ; elapsed = 00:00:03 . Memory (MB): peak = 1031.555 ; gain = 0.000
INFO: [Opt 31-389] Phase Shift Register Optimization created 0 cells and removed 0 cells

Starting Connectivity Check Task

Time (s): cpu = 00:00:00 ; elapsed = 00:00:00.030 . Memory (MB): peak = 1031.555 ; gain = 0.000
Ending Logic Optimization Task | Checksum: b7d31793

Time (s): cpu = 00:00:03 ; elapsed = 00:00:04 . Memory (MB): peak = 1031.555 ; gain = 0.000

Starting Power Optimization Task
INFO: [Pwropt 34-132] Skipping clock gating for clocks with a period < 2.00 ns.
Ending Power Optimization Task | Checksum: 93dbc155

Time (s): cpu = 00:00:00 ; elapsed = 00:00:00.068 . Memory (MB): peak = 1031.555 ; gain = 0.000
21 Infos, 0 Warnings, 0 Critical Warnings and 0 Errors encountered.
opt_design completed successfully
opt_design: Time (s): cpu = 00:00:17 ; elapsed = 00:00:18 . Memory (MB): peak = 1031.555 ; gain = 508.051
Writing placer database...
Writing XDEF routing.
Writing XDEF routing logical nets.
Writing XDEF routing special nets.
Write XDEF Complete: Time (s): cpu = 00:00:00 ; elapsed = 00:00:00.057 . Memory (MB): peak = 1031.555 ; gain = 0.000
INFO: [Common 17-1381] The checkpoint 'C:/Users/Juan Carlos/Xilinx/project 34 segment/project_34_segment/project_34_segment.runs/impl_1/test_imp_opt.dcp' has been generated.
Command: report_drc -file test_imp_drc_opted.rpt
INFO: [DRC 23-27] Running DRC with 2 threads
INFO: [Coretcl 2-168] The results of DRC are in file C:/Users/Juan Carlos/Xilinx/project 34 segment/project_34_segment/project_34_segment.runs/impl_1/test_imp_drc_opted.rpt.
report_drc completed successfully
INFO: [Chipscope 16-241] No debug cores found in the current design.
Before running the implement_debug_core command, either use the Set Up Debug wizard (GUI mode)
or use the create_debug_core and connect_debug_core Tcl commands to insert debug cores into the design.
Command: place_design
Attempting to get a license for feature 'Implementation' and/or device 'xc7a35t-cpg236'
INFO: [Common 17-349] Got license for feature 'Implementation' and/or device 'xc7a35t-cpg236'
Command: report_drc (run_mandatory_drcs) for: incr_eco_checks
INFO: [DRC 23-27] Running DRC with 2 threads
report_drc (run_mandatory_drcs) completed successfully
INFO: [Vivado_Tcl 4-198] DRC finished with 0 Errors
INFO: [Vivado_Tcl 4-199] Please refer to the DRC report (report_drc) for more information.
Running DRC as a precondition to command place_design
Command: report_drc (run_mandatory_drcs) for: placer_checks
INFO: [DRC 23-27] Running DRC with 2 threads
report_drc (run_mandatory_drcs) completed successfully
INFO: [Vivado_Tcl 4-198] DRC finished with 0 Errors
INFO: [Vivado_Tcl 4-199] Please refer to the DRC report (report_drc) for more information.

Starting Placer Task
INFO: [Place 30-611] Multithreading enabled for place_design using a maximum of 2 CPUs

Phase 1 Placer Initialization

Phase 1.1 Placer Initialization Netlist Sorting
Netlist sorting complete. Time (s): cpu = 00:00:00 ; elapsed = 00:00:00.031 . Memory (MB): peak = 1031.555 ; gain = 0.000
Phase 1.1 Placer Initialization Netlist Sorting | Checksum: 7b1ca740

Time (s): cpu = 00:00:00 ; elapsed = 00:00:00.087 . Memory (MB): peak = 1031.555 ; gain = 0.000
INFO: [Timing 38-35] Done setting XDC timing constraints.
INFO: [Opt 31-138] Pushed 0 inverter(s) to 0 load pin(s).
Netlist sorting complete. Time (s): cpu = 00:00:00 ; elapsed = 00:00:00.011 . Memory (MB): peak = 1031.555 ; gain = 0.000

Phase 1.2 IO Placement/ Clock Placement/ Build Placer Device
INFO: [Timing 38-35] Done setting XDC timing constraints.
Phase 1.2 IO Placement/ Clock Placement/ Build Placer Device | Checksum: 8c1b65ce

Time (s): cpu = 00:00:03 ; elapsed = 00:00:03 . Memory (MB): peak = 1031.555 ; gain = 0.000

Phase 1.3 Build Placer Netlist Model
Phase 1.3 Build Placer Netlist Model | Checksum: 157dc7379

Time (s): cpu = 00:00:08 ; elapsed = 00:00:06 . Memory (MB): peak = 1046.488 ; gain = 14.934

Phase 1.4 Constrain Clocks/Macros
Phase 1.4 Constrain Clocks/Macros | Checksum: 157dc7379

Time (s): cpu = 00:00:08 ; elapsed = 00:00:06 . Memory (MB): peak = 1046.488 ; gain = 14.934
Phase 1 Placer Initialization | Checksum: 157dc7379

Time (s): cpu = 00:00:08 ; elapsed = 00:00:06 . Memory (MB): peak = 1046.488 ; gain = 14.934

Phase 2 Global Placement
Phase 2 Global Placement | Checksum: 132ecb533

Time (s): cpu = 00:00:13 ; elapsed = 00:00:09 . Memory (MB): peak = 1046.488 ; gain = 14.934

Phase 3 Detail Placement

Phase 3.1 Commit Multi Column Macros
Phase 3.1 Commit Multi Column Macros | Checksum: 132ecb533

Time (s): cpu = 00:00:13 ; elapsed = 00:00:09 . Memory (MB): peak = 1046.488 ; gain = 14.934

Phase 3.2 Commit Most Macros & LUTRAMs
Phase 3.2 Commit Most Macros & LUTRAMs | Checksum: 11703d7dc

Time (s): cpu = 00:00:14 ; elapsed = 00:00:10 . Memory (MB): peak = 1046.488 ; gain = 14.934

Phase 3.3 Area Swap Optimization
Phase 3.3 Area Swap Optimization | Checksum: 18659273b

Time (s): cpu = 00:00:14 ; elapsed = 00:00:11 . Memory (MB): peak = 1046.488 ; gain = 14.934

Phase 3.4 Pipeline Register Optimization
Phase 3.4 Pipeline Register Optimization | Checksum: 18659273b

Time (s): cpu = 00:00:14 ; elapsed = 00:00:11 . Memory (MB): peak = 1046.488 ; gain = 14.934

Phase 3.5 Timing Path Optimizer
Phase 3.5 Timing Path Optimizer | Checksum: 1e86db3f2

Time (s): cpu = 00:00:15 ; elapsed = 00:00:11 . Memory (MB): peak = 1046.488 ; gain = 14.934

Phase 3.6 Small Shape Detail Placement
Phase 3.6 Small Shape Detail Placement | Checksum: f9604401

Time (s): cpu = 00:00:15 ; elapsed = 00:00:11 . Memory (MB): peak = 1046.488 ; gain = 14.934

Phase 3.7 Re-assign LUT pins
Phase 3.7 Re-assign LUT pins | Checksum: 109283c13

Time (s): cpu = 00:00:16 ; elapsed = 00:00:12 . Memory (MB): peak = 1046.488 ; gain = 14.934

Phase 3.8 Pipeline Register Optimization
Phase 3.8 Pipeline Register Optimization | Checksum: 109283c13

Time (s): cpu = 00:00:16 ; elapsed = 00:00:12 . Memory (MB): peak = 1046.488 ; gain = 14.934
Phase 3 Detail Placement | Checksum: 109283c13

Time (s): cpu = 00:00:16 ; elapsed = 00:00:12 . Memory (MB): peak = 1046.488 ; gain = 14.934

Phase 4 Post Placement Optimization and Clean-Up

Phase 4.1 Post Commit Optimization
INFO: [Timing 38-35] Done setting XDC timing constraints.

Phase 4.1.1 Post Placement Optimization
Post Placement Optimization Initialization | Checksum: 1d29f0ce4

Phase 4.1.1.1 BUFG Insertion
INFO: [Physopt 32-721] Multithreading enabled for phys_opt_design using a maximum of 2 CPUs
INFO: [Place 46-41] BUFG insertion identified 0 candidate nets, 0 success, 0 skipped for placement/routing, 0 skipped for timing, 0 skipped for netlist change reason.
Phase 4.1.1.1 BUFG Insertion | Checksum: 1d29f0ce4

Time (s): cpu = 00:00:21 ; elapsed = 00:00:16 . Memory (MB): peak = 1068.031 ; gain = 36.477
INFO: [Place 30-746] Post Placement Timing Summary WNS=9.081. For the most accurate timing information please run report_timing.
Phase 4.1.1 Post Placement Optimization | Checksum: 1345c895b

Time (s): cpu = 00:00:21 ; elapsed = 00:00:16 . Memory (MB): peak = 1068.031 ; gain = 36.477
Phase 4.1 Post Commit Optimization | Checksum: 1345c895b

Time (s): cpu = 00:00:21 ; elapsed = 00:00:16 . Memory (MB): peak = 1068.031 ; gain = 36.477

Phase 4.2 Post Placement Cleanup
Phase 4.2 Post Placement Cleanup | Checksum: 1345c895b

Time (s): cpu = 00:00:22 ; elapsed = 00:00:16 . Memory (MB): peak = 1068.031 ; gain = 36.477

Phase 4.3 Placer Reporting
Phase 4.3 Placer Reporting | Checksum: 1345c895b

Time (s): cpu = 00:00:22 ; elapsed = 00:00:16 . Memory (MB): peak = 1068.031 ; gain = 36.477

Phase 4.4 Final Placement Cleanup
Phase 4.4 Final Placement Cleanup | Checksum: 13b4cb895

Time (s): cpu = 00:00:22 ; elapsed = 00:00:16 . Memory (MB): peak = 1068.031 ; gain = 36.477
Phase 4 Post Placement Optimization and Clean-Up | Checksum: 13b4cb895

Time (s): cpu = 00:00:22 ; elapsed = 00:00:16 . Memory (MB): peak = 1068.031 ; gain = 36.477
Ending Placer Task | Checksum: 11b78d667

Time (s): cpu = 00:00:22 ; elapsed = 00:00:16 . Memory (MB): peak = 1068.031 ; gain = 36.477
40 Infos, 0 Warnings, 0 Critical Warnings and 0 Errors encountered.
place_design completed successfully
place_design: Time (s): cpu = 00:00:24 ; elapsed = 00:00:17 . Memory (MB): peak = 1068.031 ; gain = 36.477
Writing placer database...
Writing XDEF routing.
Writing XDEF routing logical nets.
Writing XDEF routing special nets.
Write XDEF Complete: Time (s): cpu = 00:00:03 ; elapsed = 00:00:01 . Memory (MB): peak = 1069.469 ; gain = 1.438
INFO: [Common 17-1381] The checkpoint 'C:/Users/Juan Carlos/Xilinx/project 34 segment/project_34_segment/project_34_segment.runs/impl_1/test_imp_placed.dcp' has been generated.
report_io: Time (s): cpu = 00:00:00 ; elapsed = 00:00:00.042 . Memory (MB): peak = 1069.469 ; gain = 0.000
report_utilization: Time (s): cpu = 00:00:00 ; elapsed = 00:00:00.064 . Memory (MB): peak = 1069.469 ; gain = 0.000
report_control_sets: Time (s): cpu = 00:00:00 ; elapsed = 00:00:00.007 . Memory (MB): peak = 1069.469 ; gain = 0.000
Command: route_design
Attempting to get a license for feature 'Implementation' and/or device 'xc7a35t-cpg236'
INFO: [Common 17-349] Got license for feature 'Implementation' and/or device 'xc7a35t-cpg236'
Running DRC as a precondition to command route_design
Command: report_drc (run_mandatory_drcs) for: router_checks
INFO: [DRC 23-27] Running DRC with 2 threads
report_drc (run_mandatory_drcs) completed successfully
INFO: [Vivado_Tcl 4-198] DRC finished with 0 Errors
INFO: [Vivado_Tcl 4-199] Please refer to the DRC report (report_drc) for more information.


Starting Routing Task
INFO: [Route 35-254] Multithreading enabled for route_design using a maximum of 2 CPUs
Checksum: PlaceDB: 1cc6f373 ConstDB: 0 ShapeSum: feb1e2f4 RouteDB: 0

Phase 1 Build RT Design
Phase 1 Build RT Design | Checksum: aee0b363

Time (s): cpu = 00:00:16 ; elapsed = 00:00:13 . Memory (MB): peak = 1195.426 ; gain = 95.188

Phase 2 Router Initialization

Phase 2.1 Create Timer
Phase 2.1 Create Timer | Checksum: aee0b363

Time (s): cpu = 00:00:16 ; elapsed = 00:00:13 . Memory (MB): peak = 1195.426 ; gain = 95.188

Phase 2.2 Fix Topology Constraints
Phase 2.2 Fix Topology Constraints | Checksum: aee0b363

Time (s): cpu = 00:00:16 ; elapsed = 00:00:13 . Memory (MB): peak = 1195.426 ; gain = 95.188

Phase 2.3 Pre Route Cleanup
Phase 2.3 Pre Route Cleanup | Checksum: aee0b363

Time (s): cpu = 00:00:16 ; elapsed = 00:00:13 . Memory (MB): peak = 1195.426 ; gain = 95.188
 Number of Nodes with overlaps = 0

Phase 2.4 Update Timing
Phase 2.4 Update Timing | Checksum: 1bd90553d

Time (s): cpu = 00:00:22 ; elapsed = 00:00:17 . Memory (MB): peak = 1212.391 ; gain = 112.152
INFO: [Route 35-416] Intermediate Timing Summary | WNS=8.997  | TNS=0.000  | WHS=-0.067 | THS=-0.067 |

Phase 2 Router Initialization | Checksum: 1224479c8

Time (s): cpu = 00:00:24 ; elapsed = 00:00:18 . Memory (MB): peak = 1212.391 ; gain = 112.152

Phase 3 Initial Routing
Phase 3 Initial Routing | Checksum: 141e364b2

Time (s): cpu = 00:00:28 ; elapsed = 00:00:20 . Memory (MB): peak = 1222.902 ; gain = 122.664

Phase 4 Rip-up And Reroute

Phase 4.1 Global Iteration 0
 Number of Nodes with overlaps = 1081
 Number of Nodes with overlaps = 1
 Number of Nodes with overlaps = 0
INFO: [Route 35-416] Intermediate Timing Summary | WNS=8.986  | TNS=0.000  | WHS=N/A    | THS=N/A    |

Phase 4.1 Global Iteration 0 | Checksum: 1f4f87eff

Time (s): cpu = 00:00:34 ; elapsed = 00:00:23 . Memory (MB): peak = 1222.902 ; gain = 122.664
Phase 4 Rip-up And Reroute | Checksum: 1f4f87eff

Time (s): cpu = 00:00:34 ; elapsed = 00:00:23 . Memory (MB): peak = 1222.902 ; gain = 122.664

Phase 5 Delay and Skew Optimization

Phase 5.1 Delay CleanUp
Phase 5.1 Delay CleanUp | Checksum: 1f4f87eff

Time (s): cpu = 00:00:34 ; elapsed = 00:00:23 . Memory (MB): peak = 1222.902 ; gain = 122.664

Phase 5.2 Clock Skew Optimization
Phase 5.2 Clock Skew Optimization | Checksum: 1f4f87eff

Time (s): cpu = 00:00:34 ; elapsed = 00:00:23 . Memory (MB): peak = 1222.902 ; gain = 122.664
Phase 5 Delay and Skew Optimization | Checksum: 1f4f87eff

Time (s): cpu = 00:00:34 ; elapsed = 00:00:23 . Memory (MB): peak = 1222.902 ; gain = 122.664

Phase 6 Post Hold Fix

Phase 6.1 Hold Fix Iter

Phase 6.1.1 Update Timing
Phase 6.1.1 Update Timing | Checksum: 20058caf5

Time (s): cpu = 00:00:35 ; elapsed = 00:00:23 . Memory (MB): peak = 1222.902 ; gain = 122.664
INFO: [Route 35-416] Intermediate Timing Summary | WNS=9.079  | TNS=0.000  | WHS=0.196  | THS=0.000  |

Phase 6.1 Hold Fix Iter | Checksum: 20058caf5

Time (s): cpu = 00:00:35 ; elapsed = 00:00:23 . Memory (MB): peak = 1222.902 ; gain = 122.664
Phase 6 Post Hold Fix | Checksum: 20058caf5

Time (s): cpu = 00:00:35 ; elapsed = 00:00:23 . Memory (MB): peak = 1222.902 ; gain = 122.664

Phase 7 Route finalize

Router Utilization Summary
  Global Vertical Routing Utilization    = 6.92386 %
  Global Horizontal Routing Utilization  = 7.77772 %
  Routable Net Status*
  *Does not include unroutable nets such as driverless and loadless.
  Run report_route_status for detailed report.
  Number of Failed Nets               = 0
  Number of Unrouted Nets             = 0
  Number of Partially Routed Nets     = 0
  Number of Node Overlaps             = 0

Phase 7 Route finalize | Checksum: 20058caf5

Time (s): cpu = 00:00:35 ; elapsed = 00:00:24 . Memory (MB): peak = 1222.902 ; gain = 122.664

Phase 8 Verifying routed nets

 Verification completed successfully
Phase 8 Verifying routed nets | Checksum: 20058caf5

Time (s): cpu = 00:00:35 ; elapsed = 00:00:24 . Memory (MB): peak = 1222.902 ; gain = 122.664

Phase 9 Depositing Routes
Phase 9 Depositing Routes | Checksum: 18f6b089e

Time (s): cpu = 00:00:36 ; elapsed = 00:00:25 . Memory (MB): peak = 1222.902 ; gain = 122.664

Phase 10 Post Router Timing
INFO: [Route 35-57] Estimated Timing Summary | WNS=9.079  | TNS=0.000  | WHS=0.196  | THS=0.000  |

INFO: [Route 35-327] The final timing numbers are based on the router estimated timing analysis. For a complete and accurate timing signoff, please run report_timing_summary.
Phase 10 Post Router Timing | Checksum: 18f6b089e

Time (s): cpu = 00:00:36 ; elapsed = 00:00:25 . Memory (MB): peak = 1222.902 ; gain = 122.664
INFO: [Route 35-16] Router Completed Successfully

Time (s): cpu = 00:00:36 ; elapsed = 00:00:25 . Memory (MB): peak = 1222.902 ; gain = 122.664

Routing Is Done.
52 Infos, 0 Warnings, 0 Critical Warnings and 0 Errors encountered.
route_design completed successfully
route_design: Time (s): cpu = 00:00:38 ; elapsed = 00:00:26 . Memory (MB): peak = 1222.902 ; gain = 153.434
Writing placer database...
Writing XDEF routing.
Writing XDEF routing logical nets.
Writing XDEF routing special nets.
Write XDEF Complete: Time (s): cpu = 00:00:05 ; elapsed = 00:00:02 . Memory (MB): peak = 1222.902 ; gain = 0.000
INFO: [Common 17-1381] The checkpoint 'C:/Users/Juan Carlos/Xilinx/project 34 segment/project_34_segment/project_34_segment.runs/impl_1/test_imp_routed.dcp' has been generated.
Command: report_drc -file test_imp_drc_routed.rpt -pb test_imp_drc_routed.pb -rpx test_imp_drc_routed.rpx
INFO: [DRC 23-27] Running DRC with 2 threads
INFO: [Coretcl 2-168] The results of DRC are in file C:/Users/Juan Carlos/Xilinx/project 34 segment/project_34_segment/project_34_segment.runs/impl_1/test_imp_drc_routed.rpt.
report_drc completed successfully
Command: report_methodology -file test_imp_methodology_drc_routed.rpt -rpx test_imp_methodology_drc_routed.rpx
INFO: [Timing 38-35] Done setting XDC timing constraints.
INFO: [DRC 23-133] Running Methodology with 2 threads
INFO: [Coretcl 2-1520] The results of Report Methodology are in file C:/Users/Juan Carlos/Xilinx/project 34 segment/project_34_segment/project_34_segment.runs/impl_1/test_imp_methodology_drc_routed.rpt.
report_methodology completed successfully
Command: report_power -file test_imp_power_routed.rpt -pb test_imp_power_summary_routed.pb -rpx test_imp_power_routed.rpx
INFO: [Timing 38-35] Done setting XDC timing constraints.
Running Vector-less Activity Propagation...

Finished Running Vector-less Activity Propagation
59 Infos, 0 Warnings, 0 Critical Warnings and 0 Errors encountered.
report_power completed successfully
INFO: [Timing 38-91] UpdateTimingParams: Speed grade: -1, Delay Type: min_max.
INFO: [Timing 38-191] Multithreading enabled for timing update using a maximum of 2 CPUs
INFO: [Common 17-206] Exiting Vivado at Sat Oct 21 21:43:49 2017...
